{"finding_id":"VF-1","project_id":"PROJECT-1","cu_id":"CU-AUTH","implementation_run_id":"RUN-IMPL-1","validator_run_id":"RUN-VALIDATE-1","validation_type":"SCRUTINY","assertion_ref":{"validation_contract_id":"VC-PROJECT-1","version":1,"assertion_id":"VAL-AUTH-001"},"validator_agent_ref":{"id":"AGT-SCRUTINY","version":"1.0.0","content_hash":"sha256:bbbbbbbbbbbbbbbbbbbbbbbbbbbbbbbbbbbbbbbbbbbbbbbbbbbbbbbbbbbbbbbb"},"context_isolation":"FRESH_SESSION","severity":"BLOCKING","summary":"退出登录后旧会话仍可访问受保护接口","evidence_refs":["EVD-HTTP-1"],"status":"OPEN","code_mutation_allowed":false,"gate_authority":false,"created_at":"2026-08-05T12:00:00Z"}
